Commit_ID,Contributor,Date,Message,Files
543123040c961d00ec46b820b35855be18741683,deadprogram,2013-10-17,Initial commit,"['.jshintrc,.travis.yml,Gruntfile.js,package.json,cylon.coffee,cylon.spec.coffee,globals.js,runner.js']"
4e192e4199a202c49497762ce0613f5e80ad0792,deadprogram,2013-10-18,Canonical missing semicolon,['Gruntfile.js']
8d750660627244480a73bf5a9758f8e1827d944e,deadprogram,2013-10-18,Adding a test robot method,"['LICENSE,cylon.coffee,cylon.spec.coffee']"
162db8ea39de104263615b724489af2a78e02a14,Andrew Stewart,2013-10-18,"Correct Travis build img in README.mdWas pointing to deadprogram/cylon, now points to hybridgroup/cylon.",['']
029ae0c3876391d93f76b4fd419caad6cd2db9fb,Andrew Stewart,2013-10-18,Replace additional occurances of deadprogram/cylon,['package.json']
a2786dab482684ec4769d4feae37eb4682bbccd9,Andrew Stewart,2013-10-18,Add missing commas to setTimeouts in spec,['cylon.spec.coffee']
92c651f6b32497a7cf1be1f64ad156f40b6ee567,deadprogram,2013-10-19,Add placeholder for Robot,"['robot.coffee,robot.spec.coffee']"
e4540ead4646bfc3e0af9f0af81f5b8aabbb4efd,deadprogram,2013-10-19,Remove commented lines,"['package.json,robot.spec.coffee']"
13f3b6b1a812bf4c9e2ab4be68c8b0ac4bbe5bf5,deadprogram,2013-10-19,Placeholders for core classes,"['adaptor.coffee,connection.coffee,device.coffee,driver.coffee,adaptor.spec.coffee,connection.spec.coffee,device.spec.coffee,driver.spec.coffee']"
354bc357543d24fe66cf01c22077a65c1c84f9e0,deadprogram,2013-10-19,Remove not needed exports,"['adaptor.coffee,connection.coffee,device.coffee,driver.coffee,robot.coffee']"
f06cae322c4191b28cd4ed3d2fb4cdd7b572f663,deadprogram,2013-10-19,Fixing the example,['']
7fc9fec67354d05f519c02af4cbb33def505e878,deadprogram,2013-10-19,Fixing the example,['']
4fd5c4e74f92a7c3ba69feb73dadeb71a9cbe31e,deadprogram,2013-10-19,Fixing the example,['']
7cbf27e636280f598df810208862d236dd864a21,deadprogram,2013-10-19,Fixing the example,['']
b0f4d9f12b9ddb1f3152579eb27f08240357f1f5,deadprogram,2013-10-19,Name is just an option,"['adaptor.coffee,connection.coffee,device.coffee,driver.coffee,robot.coffee,adaptor.spec.coffee,connection.spec.coffee,device.spec.coffee,driver.spec.coffee,robot.spec.coffee']"
c9953b8830ee024142aae28d787689058a7435d4,deadprogram,2013-10-19,Work and create new robot,"['connection.coffee,cylon.coffee,device.coffee,robot.coffee,connection.spec.coffee,cylon.spec.coffee,device.spec.coffee,robot.spec.coffee']"
17be53408ae92aea7dfa3dc87c4df0c7d537ea05,deadprogram,2013-10-19,Remove anything not needed for test,['cylon.spec.coffee']
d7cc0c37300d6ef94a705e98d508673ec8b37d40,deadprogram,2013-10-19,WIP on init/start connections and devices,"['robot.coffee,cylon.spec.coffee']"
54f657e76ae7640b72a7fd804d2b3463e260fb40,deadprogram,2013-10-19,Start to connect,['robot.coffee']
d05083562044cc1eb7cdd6c0f4212480fa048b4b,deadprogram,2013-10-20,Init the connections and devices hashes,['robot.coffee']
2019cd5b6c7acc86c6387ee84c1f1d893b23169b,deadprogram,2013-10-20,All robots have a name,"['robot.coffee,robot.spec.coffee']"
520035b842a51e7adc9f1904ed03f1d7e0447bf6,deadprogram,2013-10-20,Remove space,['robot.coffee']
05cc4221aa5e40332f5d1a898e05ae2e143e7b31,deadprogram,2013-10-20,Better naming for connection and device types,['robot.coffee']
d60c624deeb7e6c717eba8a710766a6e2f9aaa2d,deadprogram,2013-10-20,Revise README order,['']
defa1cc91d79d5def642af767770774d9bb24703,deadprogram,2013-10-20,Need to be able to start,"['robot.coffee,robot.spec.coffee']"
9500b3b23a1327a134329d46b87318e3a5958bac,deadprogram,2013-10-20,Now we're doing the work,['robot.coffee']
2f6ee5866d0bcf4a48b719bd5be3585356f2518a,deadprogram,2013-10-20,"Add port, and some test output cleanup","['connection.coffee,device.coffee,port.coffee,adaptor.spec.coffee,connection.spec.coffee,cylon.spec.coffee,device.spec.coffee,driver.spec.coffee,port.spec.coffee,robot.spec.coffee']"
008f35ccbccf927a91eef7cac886dbe652982d7b,deadprogram,2013-10-20,Add some pending tests,"['connection.coffee,driver.coffee,port.coffee,robot.coffee,adaptor.spec.coffee,connection.spec.coffee,device.spec.coffee']"
e7a628b9eb510bc5e78b69810d4d44e8ab1ba0e3,Andrew Stewart,2013-10-21,Can move default arguments into signature,['robot.coffee']
21e225a4d30cc92568c802578dc06950c391e00c,Andrew Stewart,2013-10-21,Minor restructoring,['robot.coffee']
eb984aa4478aa4915f04691610c6a7aa19eeb1c4,Ron Evans,2013-10-21,Merge pull request #1 from hybridgroup/robot-reorganizationRobot.coffee - minor reorganization,['']
405632bf96020f1e3d6b422fa5df826c63790598,Andrew Stewart,2013-10-21,Run tests with Grunt,['.travis.yml']
846161c0044109b6118d43f375dd7c0cb01988dd,Andrew Stewart,2013-10-21,Install grunt-cli before running Travis script,['.travis.yml']
9e7614a4a1ae085fb708af4c62c74b32f890affa,Andrew Stewart,2013-10-21,Add Port class functionality and tests from Artoo,"['port.coffee,port.spec.coffee']"
ea90ed88894a0745071104f0692f04a827116a72,Andrew Stewart,2013-10-22,Add utility functions and monkey-patches,"['cylon.coffee,utils.coffee,utils.spec.coffee']"
8b1f3429642fc93fa06f4429c405bcc37c376069,deadprogram,2013-10-22,Correct syntax outside of tests,"['package.json,connection.coffee,cylon.coffee,robot.coffee']"
f03eac212ebfd9cd8f6d70500ed2567eb7d3c357,deadprogram,2013-10-22,Resolve merge conflicts,['']
f2e90634c595447772af339e7e6421ebe1a55a7b,deadprogram,2013-10-22,hello?,['test.js']
af4636598aabcaa225878276ad29cbdfa22b97fe,deadprogram,2013-10-22,WIP on device,"['device.coffee,device.spec.coffee']"
2e74b8bdef4ee484b5903c7a51172cc98f5d0b8a,deadprogram,2013-10-22,Starting to build the object chain,"['cylon.coffee,device.coffee,robot.coffee']"
bc9dd05cbcc21612c089f3cece7b1b7f9904496e,Andrew Stewart,2013-10-22,Fix example and globally namespace utility functions,"['test.js,cylon.coffee,utils.coffee']"
719790fc807b4c613e48474bbc8406c6d1c95106,Andrew Stewart,2013-10-22,Additions/cleanup to README.md,['']
30db92328d215ff2cccbb64f2f0f22cf4363bcf9,Andrew Stewart,2013-10-22,Properly init/start connections and devices,"['connection.coffee,robot.coffee']"
de797004271af63612f1d633b16e6e10d98e2612,Andrew Stewart,2013-10-22,Correct and consistent context for work functionsAlso corrects context(this) issues for every() and after(),"['test.js,robot.coffee']"
48db540d3746d347b41bdaeeb13621ec5e0cef83,deadprogram,2013-10-22,Connections and Devices should belong to a robot,"['connection.coffee,device.coffee,robot.coffee,connection.spec.coffee,device.spec.coffee']"
1f93cee8238c2b1271635922f8665b1a807cd3c2,deadprogram,2013-10-22,Resolve merge conflicts,['']
03febed1bb4b7d4ed531b28ef423b8e71c843d90,deadprogram,2013-10-22,Knowledge of self when working,"['test.js,robot.coffee']"
375c70c1ac8258a69a776888e289f48df8d1172f,Andrew Stewart,2013-10-22,Fix 'CoffeeScrip' in README.md,['']
ce154f8d25c09823b09ca07962c58a3355f8697f,deadprogram,2013-10-22,Removing commentted line,['robot.coffee']
3b83b5d0f7e4b9231b6677d51a9a4071eb24c455,deadprogram,2013-10-22,Simplify robot init even further,"['device.coffee,robot.coffee']"
7ab34693fa1af5a3bb4a3345296daf17440fdfb7,Andrew Stewart,2013-10-22,Simplify starting work,['robot.coffee']
c25324c2257be56665d1f4151395770efaf1af8d,deadprogram,2013-10-22,Specify more pending tests for Device,['device.spec.coffee']
60a7363985e20f7cf603165e4b144aac7ebc5049,deadprogram,2013-10-22,Correct reference to parent robot,['device.coffee']
da95bccdfa93b9b0598510f6dc4701669d117a93,Andrew Stewart,2013-10-22,Add global Logger object,"['connection.coffee,cylon.coffee,device.coffee,driver.coffee,logger.coffee,robot.coffee,logger.spec.coffee,robot.spec.coffee']"
ca59493a12ced685bb0563e49ddba3a3b44a2fa7,deadprogram,2013-10-22,Proper initialization of device,"['device.coffee,robot.coffee,device.spec.coffee']"
8b390cc4863d33c47a4497c7731bb60de4502482,deadprogram,2013-10-22,Resolve merge conflicts with master,['']
7b67ffadd7411b61519d29c492098351d6a1e97c,Ron Evans,2013-10-22,Merge pull request #3 from hybridgroup/loggerAdd global Logger object,['']
42cd14cf1484ee536bb4dbf3c9c988ef64737e48,deadprogram,2013-10-22,A little test output reformat,"['adaptor.spec.coffee,connection.spec.coffee,cylon.spec.coffee,device.spec.coffee,driver.spec.coffee,logger.spec.coffee,robot.spec.coffee,utils.spec.coffee']"
132282d4c2793ca9df3ae3ab1092c66eebadb6ed,deadprogram,2013-10-22,Much along the way to adaptor/driver registration and loading,"['hello.js,robot.coffee,device.spec.coffee']"
a46a8c4a712924aca8e4b991ab7281bd614e98b6,deadprogram,2013-10-22,Hello in both javascript and coffeescript,"['hello.coffee,hello.js']"
7e98fdd96b320fbba85aa0c332af273a00c244a6,deadprogram,2013-10-22,Both every and after,"['hello.coffee,hello.js']"
68b0c1dc09fbc5924c8ff51e08faf21d69638e6a,deadprogram,2013-10-22,I like this capitalization,"['hello.coffee,hello.js,test.js']"
8252d38a5e4a061ccd126bdc4b8bf8fd5631bd88,deadprogram,2013-10-23,WIP on dynamic loading of adaptor and driver modules,"['hello.js,connection.coffee,loopback.coffee,robot.coffee,connection.spec.coffee']"
b3131fb0b62b0bf7382c0ce42f137cac9e589a00,deadprogram,2013-10-23,More progress now just need correct export,"['loopback.coffee,robot.coffee']"
7c551f41c6bc195bde3034ab1e68093597fe0b19,deadprogram,2013-10-23,"Code runs, tests fail","['connection.coffee,device.coffee,driver.coffee,loopback.coffee,port.coffee']"
72c357b64be21264c3b983aeb90405287c00f5b7,deadprogram,2013-10-23,Adding back comments line,['connection.coffee']
541d70b66da0ad07724d112aefad8b971df72762,Andrew Stewart,2013-10-23,Correctly set up loopback adaptor,"['loopback.coffee,robot.coffee']"
bf4d42970e4e5d6e5c140c1f15b2c040b3850d87,Andrew Stewart,2013-10-23,Proper initialization of adaptors,"['connection.coffee,loopback.coffee,robot.coffee']"
f0ca9ee60b398799ba0a0b5ec8a74b6609bad1d5,Andrew Stewart,2013-10-23,Use fat arrows (=>) to simplify scope management,['robot.coffee']
dbe4ccbbd54000047265a6124b5a9142636aa01a,Andrew Stewart,2013-10-23,Fix connection test failure,['connection.spec.coffee']
1209686388bf8b6aa12c16ea9354059c75b65630,deadprogram,2013-10-23,"Making test pending, for now",['cylon.spec.coffee']
945273924479d8b4195b514b3fd6e5556e2cee85,Andrew Stewart,2013-10-23,Add addProxy() method to Adaptor class,"['adaptor.coffee,adaptor.spec.coffee']"
ecdc417a585cb88e6303938a9e309f933eb701c3,Andrew Stewart,2013-10-23,Revise Logger to accept multiple arguments,"['logger.coffee,logger.spec.coffee']"
82c530fe5b452ac33488a0ee63dc87c40749106b,Andrew Stewart,2013-10-23,Example of using cylon-sphero adaptor,"['sphero.coffee,package.json,connection.coffee,robot.coffee']"
4a57300d32a9a15d6b1578356ba2d8e56e10bdb9,Andrew Stewart,2013-10-23,Fix test fails,"['loopback.coffee,robot.coffee,connection.spec.coffee']"
61e8c776c3f3d54a9e6353b3b00a992767c2ed14,Andrew Stewart,2013-10-23,Remove unnecessary dependency,['package.json']
2c34f4c77ef2265fe037e5cd55ffff2cefda3752,Andrew Stewart,2013-10-23,Fix issues with registerAdaptor,['robot.coffee']
2c6d7ea7c3a6958823c7c0d9232e8708bc73390c,Andrew Stewart,2013-10-23,Pass connection when requiring adaptors,['robot.coffee']
0e5f27f1c682673cc32918e5d2fb58b66286c540,Andrew Stewart,2013-10-23,Allow for similar hooking into drivers,['robot.coffee']
e8095a2ffde5d0c606844940f96c799c8500648c,Edgar O Silva,2013-10-23,Fixes issue with connection port not being found in adaptor.,"['sphero.coffee,connection.coffee']"
b8af863aaddbf8a96d103722eee3c71ab98f9d4d,Andrew Stewart,2013-10-23,Switch to singleton robot Master,"['hello.coffee,hello.js,master.coffee,sphero.coffee,test.js,cylon.coffee']"
015ad3823ca1372b17561dead7d815d72074b774,Edgar O Silva,2013-10-23,Move self = this into instance scope.,['connection.coffee']
ae664011071afd1e6dda2aac8a3fbca37846285a,Ron Evans,2013-10-23,Merge pull request #4 from hybridgroup/connection-port-bugFixes issue with connection port not being found in adaptor.,['']
5fba02ae84b107a7a09474739add4c21f8ec0123,deadprogram,2013-10-23,Remove cylon-sphero dependency should be the other way around,['package.json']
5f83d2f62603c2b064766eab82e618a1e21353d5,Andrew Stewart,2013-10-23,Easier singleton generation,"['master.coffee,cylon.coffee']"
e32b1b82fd0b5be5daf69adaa163dce96ffc63ea,deadprogram,2013-10-23,Small correction to examples,"['hello.coffee,sphero.coffee,test.js']"
abd742df3f57f0ec3a5207e7c33a0e8166f7d371,Ron Evans,2013-10-23,Merge pull request #5 from hybridgroup/singletonMaster singleton class,['']
35cded3fcf2fa21061fcb2c4b7803089855db199,deadprogram,2013-10-23,Update readme,['']
78db5f3a56751ece76f8e13983c083227309826c,deadprogram,2013-10-23,Update readme,['']
29515adea73807b975b6ed8af2381be34c1e15b0,Andrew Stewart,2013-10-23,Fix driver-related issues,['robot.coffee']
b8371232d1ae34b5c56912e5a5e08b19c3191741,deadprogram,2013-10-23,Proxy commands into device from associated driver,"['device.coffee,driver.coffee,device.spec.coffee']"
a6d29ecbdd508c3f500f5cca589d24d137a8be19,deadprogram,2013-10-23,Can proxy commands from connection to associated adaptor,"['sphero.coffee,adaptor.coffee,connection.coffee,adaptor.spec.coffee,connection.spec.coffee']"
dc4d3caa6c6a82ec3594a2ea6fe471ba47128491,deadprogram,2013-10-24,Calling into the driver,['device.coffee']
b9165fa09ca39ad747a431f8884419236c6be327,deadprogram,2013-10-24,Remove commented line,['sphero.coffee']
f8eb77c95924d83825370643b4f02fa726d20641,deadprogram,2013-10-24,Remove the extra messages,['device.coffee']
10bccd896dda680bb6fe815c6a669292b2207447,deadprogram,2013-10-24,A bit more cleanup of self,"['device.coffee,driver.coffee,loopback.coffee,port.coffee,driver.spec.coffee']"
0ac38c735ae8eb3fc8cd826f7bce8dde31f73608,deadprogram,2013-10-24,Add the new code climate for JS,['']
3310dee2605c793eafc77e975eb97b7d4a2ecaf4,Andrew Stewart,2013-10-24,Rewritten 'Master' example,['master.coffee']
31aa6e490146e1714c9ff3b01260ef22fa19f374,Andrew Stewart,2013-10-24,Fix scope for performing work,['robot.coffee']
f169e5c10b6e59ab6d705076d1caf1ebbf844f47,Ron Evans,2013-10-24,Merge pull request #6 from hybridgroup/fix-work-scopeFix scope for work(),['']
cc24e89249a1a02d59c9ab1e550713b1d88e0cd5,Edgar O Silva,2013-10-24,WIP on event emitter for device and connection.,"['sphero.coffee,connection.coffee,device.coffee']"
a50ccc65481e0488c1e7fdc15eb753739f3cdf23,Edgar O Silva,2013-10-24,Trigger event on device connection example.,['sphero.coffee']
06f307afc9046430ff774caf4a83040fd5980229,Edgar O Silva,2013-10-24,WIP on collision detection and event emitter.,"['sphero.coffee,connection.coffee,device.coffee']"
f6797a47825620ac41035f61208f1d05d554da1d,Edgar O Silva,2013-10-24,Added roll back to the example.,['sphero.coffee']
838aa9065a19c64b09cffcaf13655aa9e6a49b1e,Edgar O Silva,2013-10-24,Added colors to example.,"['adaptor.js,connection.js,cylon.js,device.js,driver.js,logger.js,loopback.js,port.js,robot.js,utils.js,no_such_method.coffee,sphero.coffee,adaptor.spec.js,connection.spec.js,cylon.spec.js,device.spec.js,driver.spec.js,logger.spec.js,port.spec.js,robot.spec.js,utils.spec.js']"
b0ea445cb15c00d82fae34ed642ef47fb2935f63,Ron Evans,2013-10-24,Merge pull request #7 from hybridgroup/add-event-emitterAdd event emitter to device and connection.,['']
612ddce14209726ba58beb8ee9a655c0f3b93cac,Andrew Stewart,2013-10-24,"Connections don't need direct binding, just Devices","['robot.js,robot.coffee']"
b0346204a094bfafa1082e77df78da29429e119a,Andrew Stewart,2013-10-24,Add Travis-CI build status check example,['travis.coffee']
046c3578a5e0d5b3df578ba39fc17546edb0f02a,deadprogram,2013-10-24,More examples please,"['sphero_messages.coffee,sphero_multiple.coffee']"
6bf47abf3cfcfbc164362fac4f5b05bb2b2ebc3f,deadprogram,2013-10-24,Color sphero example,['sphero_color.coffee']
b6ff2cd361dd4754390c1800f0576dfd2b575377,deadprogram,2013-10-24,How you like me now?,['travis.coffee']
1064e75128b2eac9fcf372a661694e41d67820b1,Andrew Stewart,2013-10-24,Clear up scope,"['robot.js,robot.coffee']"
c5392f3e192fcf534bcb6f2846afd054cabfb8b1,deadprogram,2013-10-25,The examples shown at js.la,"['hello.js,sphero.coffee,sphero_color.coffee,sphero_multiple.coffee']"
62d7fbee3f421099792a20959d07716f7302a3f4,deadprogram,2013-10-25,"Correct code examples, and link to Artoo",['']
3f19d14fe214e3431171984b1196e4c9a6fb0701,deadprogram,2013-10-25,Include reference to artoo,['']
f2cf92644b93bc8a0609f45e4ee22c85c3c83962,deadprogram,2013-10-25,Better multiple,['multiple.coffee']
69a476dfbf62c2f75f880f9681e22f9dd1924632,deadprogram,2013-10-25,Correct missing command in loopback test adaptor,"['loopback.js,multiple.coffee,loopback.coffee']"
7a67dbfd22e4d74f2c179d04efca5ef134f694de,deadprogram,2013-10-25,Namespace all the adaptors,"['loopback.js,multiple.coffee,loopback.coffee']"
fea55228ccf2c89e0e7a026586be63f8f7f87736,deadprogram,2013-10-25,Added ping driver for testing,"['ping.js,robot.js,multiple.coffee,ping.coffee,robot.coffee']"
7f730ed3be6387f3acc6301bdb08dcd99f9b1fb5,deadprogram,2013-10-25,Added section placeholder for hardware support,['']
450a87e17ea38ff5e38a770f4a95a4d1375cea00,Edgar O Silva,2013-10-25,Fixes issue with events not being triggered in drivers because .start was not being called to setup.,"['device.js,robot.js,pure_spheron.coffee,sphero_messages.coffee,device.coffee,robot.coffee']"
9bfd8ce57d157d62d7368d73f9b2ab996f917db4,Ron Evans,2013-10-25,Merge pull request #8 from hybridgroup/event-triggering-fixFixes issue with events not being triggered in drivers because .start wa...,['']
5e6bf8763bd35275c2142d155b3e07b808b0a7f9,deadprogram,2013-10-25,Devices need pin,"['device.js,device.coffee']"
e43bf8ad458030e2b37053aa9794410597e87a6f,deadprogram,2013-10-25,"Works for arduino blink, with new async hotness","['connection.js,device.js,loopback.js,robot.js,blink.coffee,package.json,connection.coffee,device.coffee,loopback.coffee,robot.coffee,robot.spec.js,robot.spec.coffee']"
79f02193ca9afde2b2fe24fa7458ad3a74c9cbf3,deadprogram,2013-10-25,All green,['robot.spec.js']
08da7d3390108a7fc73af3ee4eff822bd849289d,deadprogram,2013-10-26,Some logging for debug mode only,"['connection.js,device.js,robot.js,connection.coffee,device.coffee,robot.coffee']"
3eb09259d8d40b0ab1288482f0a343ff61c6f1ec,deadprogram,2013-10-26,Add links to readme to adaptor modules,['']
c94549bf75a413125fefc4ba3d4ec774457543e2,deadprogram,2013-10-26,README and example synced up,['blink.coffee']
16a049f5863a01936447bb6bd09e5649823a87a0,deadprogram,2013-10-26,"Pass requested driver name to driver module, for those that contain multiple drivers","['robot.js,robot.coffee']"
8372486a00235adcf7e90fddc58d8081c4b17b92,deadprogram,2013-10-28,Almost the button example,['button.coffee']
01b2d84bd10174f49946b873e38790d560958139,Andrew Stewart,2013-10-28,Add method to proxy functions between objects,"['utils.js,utils.coffee']"
21624ffacda8554527b1606d5ef30d9500bac49f,Andrew Stewart,2013-10-28,Use proxyFunctionsToObject for Connection and Device,"['connection.js,device.js,connection.coffee,device.coffee']"
c5cf70a5af3dc25101f091e02c31b3447e4e25dc,Andrew Stewart,2013-10-28,Remove irrelevant tests,"['connection.spec.js,device.spec.js,connection.spec.coffee,device.spec.coffee']"
6a52e7f869ab2203d494b6107e9d2916bf15b128,deadprogram,2013-10-28,Tweak to button example,['button.coffee']
c33a99e4bd0807940fe3b9a94cb86e330f1bb8d0,Andrew Stewart,2013-10-28,Add tests for proxyFunctionsToObject,"['utils.spec.js,utils.spec.coffee']"
9857a45a8a06676060e8f1fa92e4ef259c0c6aa4,Ron Evans,2013-10-28,Merge pull request #9 from hybridgroup/proxy-functionsProxy Functions From Object To Target,['']
97b73357840436510d5ba580e262da7820188b6e,deadprogram,2013-10-28,Merged better startup routine,"['device.js,robot.js,button.coffee,device.coffee,robot.coffee']"
6b5b851b639309b91e67a6d03336d185254ace95,deadprogram,2013-10-28,Use the right event,['button.coffee']
76cfbbe765f421af52b805f23058b023a73608bd,Andrew Stewart,2013-10-28,Correctly proxy methods for classes,"['connection.js,device.js,utils.js,connection.coffee,device.coffee,utils.coffee']"
5da9ac3216fd95399f483828687336a756a88832,Andrew Stewart,2013-10-28,Fix test fails,"['utils.spec.js,utils.spec.coffee']"
1f48fd85343dcdd22bf520b3bec9e4474d5c2038,deadprogram,2013-10-28,Working button/LED,['button.coffee']
507e381ae663c1751ec5739e51d82ce23ac0b2e8,Edgar O Silva,2013-10-28,Sphero Collision event example.,['sphero_collision.coffee']
d87c63dc267beef94bd4a5141daaeb72149841be,deadprogram,2013-10-28,Cleanup startConnections and startDevices to ensure proper async startup,"['connection.js,robot.js,connection.coffee,robot.coffee']"
517a093604bca0cf9a17953e0c5177b09cb84bdc,Edgar O Silva,2013-10-28,Added collision event to the messages example and updated collision example.,"['sphero_collision.coffee,sphero_messages.coffee']"
83f5e6c4c39829406a111ce0875dbc874199f3d3,Ron Evans,2013-10-28,Merge pull request #11 from hybridgroup/12-add-collision-eventSphero Collision event example.,['']
c7afd8333623927711c2cac26d7d47947d9448ed,Edgar O Silva,2013-10-28,Updated collision example to perform better and start running when you drop the sphero.,['sphero_collision.coffee']
4268a25ad7efbf763cc1c7960fab0d0cd0e8ce62,Ron Evans,2013-10-28,Merge pull request #12 from hybridgroup/12-upd-collision-exampleUpdated collision example to perform better and start running when you d...,['']
b29f911628d0b1be807c1ecfad8872e58a7932f2,deadprogram,2013-10-28,Update to version 0.1.0,['package.json']
a95bd2e0ee9cf7e29cb91ef37c5ad0c3e74f940e,deadprogram,2013-10-28,Some pure JS examples for the purists,"['blink.js,button.js,travis.js']"
e53c598ade8f6fe26ac88d445bf8bb7944c017bc,deadprogram,2013-10-28,Add ARDRone to README,['']
504e51bd28d3895d1e98b4d2650868e385a6581c,deadprogram,2013-10-28,Can now attach users own functions to robot at will,"['ping.js,robot.js,multiple.coffee,ping.coffee,robot.coffee,robot.spec.js,robot.spec.coffee']"
1c3d2236a05b6d7d881b8969c9bae21df03409ff,Andrew Stewart,2013-10-29,Add Basestar class for use in external modules,"['basestar.js,robot.js,basestar.coffee,robot.coffee']"
562b91af94f6fa334c3dd52cebc6c0320c350773,Andrew Stewart,2013-10-29,Add node-namespace to package.json,['package.json']
3f494dd23dd96ca49610a1c2a0645acc8e015d1d,Andrew Stewart,2013-10-29,Basestar extends EventEmitter,"['basestar.js,basestar.coffee']"
46a0f385484ce838a6441b523276b45c7084f18d,Ron Evans,2013-10-29,Merge pull request #13 from hybridgroup/basestarAdd Basestar class for use in external modules,['']
d7446915c02d3d53dea1aee5cd8a4d50f463cf21,Andrew Stewart,2013-10-29,Add node-restify and socket.io to package.json,['package.json']
43354cde418537b24efa267871f6200fa37488cb,Andrew Stewart,2013-10-29,Start for Cylon API Server,['api.coffee']
2e0d0423bbb662741ca2b45d311739f58ad51482,Edgar O Silva,2013-10-29,Adding analog sensor support to cylon GPIO.,"['device.js,robot.js,analog_sensor.coffee,device.coffee,robot.coffee']"
cf6d2c88bc0614353b810e557efa07978b1fe1fb,Edgar O Silva,2013-10-29,"Removing DriverName param in favor of opts, which already contains it.","['device.js,device.coffee']"
03450dbac78c7c087ab135a718eb9fafdcce274e,Ron Evans,2013-10-29,Merge pull request #14 from hybridgroup/8-analog-sensorAdding analog sensor support to cylon GPIO.,['']
a8c8b9f832b7a01726fbb784d0f994438cadb730,deadprogram,2013-10-30,Updates for version 0.2.0,['package.json']
92232812e9665c677180968d263850a5db565c90,deadprogram,2013-10-30,Need a line break,['']
a58ed257b8cb380bb5968951c5b08c56a106449b,Andrew Stewart,2013-10-30,"Merge branch 'master' into api* master:  Need a line break  Updates for version 0.2.0  Removing DriverName param in favor of opts, which already contains it.  Adding analog sensor support to cylon GPIO.",['']
b37fe4a99e6e461f45c55b22fc534aa178269683,Edgar O Silva,2013-10-30,Added examples for motor speed and led brightness.,"['led_brightness.coffee,motor.coffee']"
6a9c5eb60e2529b6570ff60742c6f88eeb2bc579,Edgar O Silva,2013-10-30,Added speed output to the example.,['motor.coffee']
05c8ad3bdc563fc3f50140c951590bea48aaae39,Andrew Stewart,2013-10-30,Add methods to export data from Robot/Device/Connection,"['connection.js,device.js,robot.js,connection.coffee,device.coffee,robot.coffee']"
2a91066864cb73e335977e6dfa574a98459008bc,Andrew Stewart,2013-10-30,Start to API and fetching of all Robots,"['api.js,cylon.js,api.coffee,cylon.coffee']"
65a2e20959df792ab98fb1093196b52a0db6784f,Andrew Stewart,2013-10-30,Add /robots/:robotid and /robots/:robotid/devices,"['api.js,cylon.js,api.coffee,cylon.coffee']"
ea472f9e129462339a5c347ee9b6189ff3729ff3,Edgar O Silva,2013-10-30,Fix issue with currentSpeed having to go through driver.,['motor.coffee']
bf86c6f414b85bcb29149aad38cc4053ce00c106,Edgar O Silva,2013-10-30,Adding servo driver example.,['servo.coffee']
ac8f2208805168fd957d9e3779e77153ba39b975,Ron Evans,2013-10-30,Merge pull request #15 from hybridgroup/9-motor-driverAdds motor driver example and led brightness.,['']
4f96890d6571e168d61e9eb8e27b3547d2b980fa,Ron Evans,2013-10-30,Merge pull request #16 from hybridgroup/10-servo-driverAdding servo driver example.,['']
0a7dba1128ce6658668bf0cb23d4d5ea01b3d49e,deadprogram,2013-10-31,Correct README typo,['']
a7d4a9d30042046a0eb197a18cc0119b498bd036,deadprogram,2013-10-31,Adding some more examples,"['conway_sphero.coffee,drone.coffee,drone_nav.coffee']"
6999236fe0a4026c4ca1edd63ae72ce8c64067e4,deadprogram,2013-10-31,Better class oriented code,['conway_sphero.coffee']
1b4e05575cc6211fc7bfb22d69a9d81cd1f50dae,Andrew Stewart,2013-10-31,Add method for fetching a specific device belonging to a Robot,"['api.js,api.coffee']"
54e5226dd6f9becb0f051071438b3f9831f6e7ff,Andrew Stewart,2013-10-31,Callbacks are cool,"['api.js,cylon.js,api.coffee,cylon.coffee']"
4120bc3b76bde4608bae86c8761e2ab421f4c996,deadprogram,2013-10-31,Pure JS drone example,['drone.js']
fbadbac5c6046d4e6b86e3eaacb097b16d39b8bb,Andrew Stewart,2013-10-31,Small method rename,"['api.js,api.coffee']"
d9c0229a6293227ed068e42455b5d5f54a64ab8b,Andrew Stewart,2013-10-31,Add API method for fetching device commands,"['api.js,api.coffee']"
